{
 "protocol_version": 1,
 "target_format": "kicad",
 "target_file": "board.kicad_sch",
 "ops": [
  {
   "op": "place_component",
   "lib_id": "Device:C_Polarized",
   "designator": "C1",
   "x_mil": 1000,
   "y_mil": 1200,
   "value": "10u"
  },
  {
   "op": "place_component",
   "lib_id": "Device:C",
   "designator": "C2",
   "x_mil": 1500,
   "y_mil": 1200,
   "value": "100n"
  },
  {
   "op": "place_component",
   "lib_id": "Device:C",
   "designator": "C3",
   "x_mil": 2000,
   "y_mil": 1200,
   "value": "100n"
  },
  {
   "op": "add_net_label",
   "at": "C1.1",
   "name": "3V3"
  },
  {
   "op": "add_net_label",
   "at": "C2.1",
   "name": "3V3"
  },
  {
   "op": "add_net_label",
   "at": "C3.1",
   "name": "3V3"
  },
  {
   "op": "add_net_label",
   "at": "C1.2",
   "name": "GND"
  },
  {
   "op": "add_net_label",
   "at": "C2.2",
   "name": "GND"
  },
  {
   "op": "add_net_label",
   "at": "C3.2",
   "name": "GND"
  }
 ]
}